[
  {
    "contractRoot": "0101010101010101010101010101010101010101010101010101010101010101",
    "signedContractSeal": "0202020202020202020202020202020202020202020202020202020202020202",
    "walletAddress": "rH9ESAdrFfDAZtCZGa7JiwNJfKnC6CmGFQ",
    "xPubA": "ED06895BEC3FDE4090F06D840770D888D49E3089B3757C4285E3851BC33964E0F9",
    "xPubB": "EDC1410EC4922A21B6F3CA7F376AD88074293F0F94119EB211FE83E75C7C7AC643",
    "commitmentA": "0303030303030303030303030303030303030303030303030303030303030303",
    "commitmentB": "0404040404040404040404040404040404040404040404040404040404040404",
    "idMethodA": "zkpassport",
    "idMethodB": "nfc-chip",
    "identityPolicy": "zk-or-chip",
    "lawyerPubA": "ED26D54D80051A116166CF76FEA87330D546680B875827B87AF1B1D58B9EB464E1",
    "lawyerPubB": "ED7B9E49FF65B0E2A2834771A03982C68FE301AE13AD8FE3C7D37D718DED4BE414",
    "lawyerCommitmentA": "0505050505050505050505050505050505050505050505050505050505050505",
    "lawyerCommitmentB": "0606060606060606060606060606060606060606060606060606060606060606",
    "lawyerOpsA": "rHhr2iRBgp3ZzzNH4YGQ59G7VAiGPEWj7f",
    "lawyerOpsB": "rEhh6f9rj5UUBhFzGGaxS5zYU2CCqKFXBC",
    "releaserAccount": "rEhh6f9rj5UUBhFzGGaxS5zYU2CCqKFXBC",
    "slotPolicyA": "0707070707070707070707070707070707070707070707070707070707070707",
    "slotPolicyLA": "0808080808080808080808080808080808080808080808080808080808080808",
    "slotPolicyB": "0909090909090909090909090909090909090909090909090909090909090909",
    "slotPolicyLB": "0a0a0a0a0a0a0a0a0a0a0a0a0a0a0a0a0a0a0a0a0a0a0a0a0a0a0a0a0a0a0a0a",
    "pqKeyHashA": "0b0b0b0b0b0b0b0b0b0b0b0b0b0b0b0b0b0b0b0b0b0b0b0b0b0b0b0b0b0b0b0b",
    "pqKeyHashLA": "0c0c0c0c0c0c0c0c0c0c0c0c0c0c0c0c0c0c0c0c0c0c0c0c0c0c0c0c0c0c0c0c",
    "pqKeyHashB": "0d0d0d0d0d0d0d0d0d0d0d0d0d0d0d0d0d0d0d0d0d0d0d0d0d0d0d0d0d0d0d0d",
    "pqKeyHashLB": "0e0e0e0e0e0e0e0e0e0e0e0e0e0e0e0e0e0e0e0e0e0e0e0e0e0e0e0e0e0e0e0e",
    "signerAccounts": [
      "r3sNTMefq5gsRumMYsNznnX6yzzxVH6dTC",
      "rpjfAeE3DeeHPFnN2PgGFW5YxnZFAjrEyN",
      "rPPdduC9MRTrXZP1J7MQyEKKEYiFigWZ6Q",
      "rfPaNmieF15VqV752Q8qAc6ugtkKhWsA2R"
    ],
    "quorum": 4,
    "payoutA": "r3sNTMefq5gsRumMYsNznnX6yzzxVH6dTC",
    "payoutB": "rPPdduC9MRTrXZP1J7MQyEKKEYiFigWZ6Q:12345"
  }
]
